 7 2.569184049    10.0.2.15 → 216.58.206.238 TCP 74 39824 → 80 [SYN] Seq=0 Win=29200 Len=0 MSS=1460 SACK_PERM=1 TSval=24444054 TSecr=0 WS=128
 8 2.593631499 216.58.206.238 → 10.0.2.15    TCP 60 80 → 39824 [SYN, ACK] Seq=0 Ack=1 Win=65535 Len=0 MSS=1460
 9 2.593662511    10.0.2.15 → 216.58.206.238 TCP 54 39824 → 80 [ACK] Seq=1 Ack=1 Win=29200 Len=0
10 2.593764669    10.0.2.15 → 216.58.206.238 HTTP 128 GET / HTTP/1.1 
11 2.593903054 216.58.206.238 → 10.0.2.15    TCP 60 80 → 39824 [ACK] Seq=1 Ack=75 Win=65535 Len=0
12 2.619423736 216.58.206.238 → 10.0.2.15    HTTP 567 HTTP/1.1 302 Found  (text/html)
13 2.619439049    10.0.2.15 → 216.58.206.238 TCP 54 39824 → 80 [ACK] Seq=75 Ack=514 Win=30016 Len=0
14 2.619578672    10.0.2.15 → 216.58.206.238 TCP 54 39824 → 80 [FIN, ACK] Seq=75 Ack=514 Win=30016 Len=0
15 2.620372656 216.58.206.238 → 10.0.2.15    TCP 60 80 → 39824 [ACK] Seq=514 Ack=76 Win=65535 Len=0
16 2.644197339 216.58.206.238 → 10.0.2.15    TCP 60 80 → 39824 [FIN, ACK] Seq=514 Ack=76 Win=65535 Len=0
17 2.644259910    10.0.2.15 → 216.58.206.238 TCP 54 39824 → 80 [ACK] Seq=76 Ack=515 Win=30016 Len=0
